{
    "timestamp": "2025-07-14T08:50:05-07:00",
    "backup_type": "data-only",
    "has_issues": true,
    "summary": "Schema mismatches detected: 2 tables have column mismatches",
    "details": {
        "extra_tables": [],
        "missing_tables": [],
        "column_differences": {
            "consumables": {
                "extra_columns": [],
                "missing_columns": {
                    "2": "consumable_type_id",
                    "3": "consumable_unit_id"
                }
            },
            "payments": {
                "extra_columns": [],
                "missing_columns": {
                    "5": "transaction_id"
                }
            }
        },
        "summary": "Schema mismatches detected: 2 tables have column mismatches",
        "has_issues": true,
        "data_only_warning": "\u26a0\ufe0f WARNING: This data-only backup has schema mismatches. Restore may fail for tables with column differences."
    },
    "formatted_report": "\u26a0\ufe0f Schema mismatches detected: 2 tables have column mismatches\n\n\ud83d\udd27 Tables with column mismatches:\n   \ud83d\udcca Table: consumables\n      \ud83d\udfe1 In MIGRATIONS but NOT in database: consumable_type_id, consumable_unit_id\n         \u2192 These columns are defined in migrations but don't exist in your database\n         \u2192 Action: Run 'php artisan migrate' OR the column was manually dropped\n\n   \ud83d\udcca Table: payments\n      \ud83d\udfe1 In MIGRATIONS but NOT in database: transaction_id\n         \u2192 These columns are defined in migrations but don't exist in your database\n         \u2192 Action: Run 'php artisan migrate' OR the column was manually dropped\n\n\ud83d\udca1 Impact on Backups:\n   \u2022 Full backups: Will work fine (includes current schema)\n   \u2022 Data-only backups: May fail - backup expects columns that don't exist\n"
}